date,title,description,source,url
2026-04-06,S&P 500 rises as investors await possible Iran and U.S. ceasefire: Live updates - CNBC,S&P 500 rises as investors await possible Iran and U.S. ceasefire: Live updatesCNBC Dow Gains on Hopes for Iran Peace TalksBarron's US stocks and oil prices flip-flop ahead of Trump’s deadline to bomb Iranian power plantsAP News Stock market today: US stocks …,Slashdot.org,https://slashdot.org/firehose.pl?op=view&amp;id=181388118
2026-04-06,"S&P 500 Climbs Above 6,600 as Iran De-Escalation Hopes Spark Relief Rally in Volatile 2026 Market","NEW YORK — The S&P 500 pushed above the 6,600 level in early trading Monday as investors welcomed tentative signs of potential de-escalation in the U.S.-Iran conflict, easing pressure from elevated oil prices that have weighed on the benchmark throughout a ch…",Ibtimes.com.au,https://www.ibtimes.com.au/sp-500-climbs-above-6600-iran-de-escalation-hopes-spark-relief-rally-volatile-2026-market-1865584
2026-04-06,Amazon India to shut down Fresh in top cities amid quick commerce push: UBS report,"Amazon’s move comes at a time when ecommerce majors are expanding their quick commerce services to meet the growing demand. Amazon Now is currently operational in six cities, including Delhi, Bengaluru, and Mumbai. This is expected to be expanded to 10-15 top…",The Times of India,https://economictimes.indiatimes.com/tech/technology/amazon-india-to-shut-down-fresh-in-top-cities-amid-quick-commerce-push-ubs-report/articleshow/130066075.cms
2026-04-06,"‘All Hell will reign’: Trump’s Easter ultimatum threatens oil supply, food prices. Hedge your nest egg for what's next",Your fall food bill could be sky high.,Yahoo Entertainment,https://finance.yahoo.com/sectors/energy/articles/hell-reign-trump-easter-ultimatum-162900739.html
2026-04-06,"Bitcoin climbs above $70,000 as more contrarian bottoming signs emerge",Sales of bitcoin by prominent holders and executive exits could give hope to the battered crypto sector.,CoinDesk,https://www.coindesk.com/markets/2026/04/06/bitcoin-climbs-above-usd70-000-as-more-contrarian-bottoming-signs-emerge
2026-04-06,Jamie Dimon defends the U.S. war on Iran—and warns it’s pushing the economy into uncharted territory,"In prior years, the JPMorgan CEO warned about economic hurricanes and banking crises. This year, it's about the unraveling global order itself.",Fortune,https://fortune.com/2026/04/06/jamie-dimon-iran-war-global-economic-order-warning/
2026-04-06,Donations surge for Tennessee librarian fired by conservative board over LGBTQ+ books,"A fundraiser for a Tennessee librarian fired for refusing to remove LGBTQ+ books from the children’s section has already raised more than $120,000 in a matter of days.",Advocate.com,https://www.advocate.com/politics/states/fired-tennessee-librarian-donations-surge
2026-04-06,Wells Fargo Investment Institute downgrades energy sector to 'unfavorable' on limited war premium,"Wells Fargo Investment Institute downgraded its rating on ​the S&P 500 ​energy sector to ""unfavorable"", citing what it ​said were limited prospects for a sustained oil-price risk premium despite the ongoing conflict in the Middle East.",The Times of India,https://economictimes.indiatimes.com/markets/us-stocks/news/wells-fargo-investment-institute-downgrades-energy-sector-to-unfavorable-on-limited-war-premium/articleshow/130065593.cms
2026-04-06,"Circle’s Arc Network Reveals Quantum Resistance Plans as Bitcoin, Ethereum Face Threat","Circle’s upcoming Arc blockchain is gearing up for quantum resilience, revealing a multi-step roadmap to prepare for the looming threat.",Decrypt,https://decrypt.co/363395/circle-arc-network-quantum-resistance-bitcoin-ethereum-face-threat
2026-04-06,"Bitmine stakes nearly 4% of all ETH, locks in NYSE uplisting","Bitmine's ETH stake and NYSE uplisting could reshape crypto investment dynamics, but concentration risks and market influence raise concerns.
The post Bitmine stakes nearly 4% of all ETH, locks in NYSE uplisting appeared first on Crypto Briefing.",Crypto Briefing,https://cryptobriefing.com/bitmine-stakes-4-percent-eth-nyse-uplisting/
2026-04-06,"Neo Alternative Asset Managers bets on real estate, ropes in ex-Walton Street India trio to lead charge",Neo Alternative Asset Managers is expanding into real estate. The firm has hired a seasoned team from Walton Street India to lead its new investment platform. This move targets structured and opportunistic real estate deals across key Indian urban markets. Th…,The Times of India,https://economictimes.indiatimes.com/industry/services/property-/-cstruction/neo-alternative-asset-managers-bets-on-real-estate-ropes-in-ex-walton-street-india-trio-to-lead-charge/articleshow/130064649.cms
2026-04-06,"US stock market today: US stocks rise as Dow, S&P 500 and Nasdaq stay in green, while Nvidia and Tesla stocks continue to slip","US stock market today is moving higher. The Dow is up over 99 points. The S&P 500 has crossed 6,600. The Nasdaq is close to 22,000. Markets are clearly in the green. But not everything is strong. Nvidia and Tesla are still under pressure. That’s catching atte…",The Times of India,https://economictimes.indiatimes.com/news/international/us/us-stock-market-today-us-stocks-rise-as-dow-sp-500-and-nasdaq-stay-in-green-while-nvidia-and-tesla-stocks-continue-to-slip/articleshow/130064313.cms
2026-04-06,"Price predictions 4/6: SPX, DXY, BTC, ETH, BNB, XRP, SOL, DOGE, HYPE, ADA","Buyers are attempting to push Bitcoin above the $70,000 level, but some analysts believe the upside may be limited and a drop below the $60,000 support is likely.",Cointelegraph,https://cointelegraph.com/markets/price-predictions-4-6-spx-dxy-btc-eth-bnb-xrp-sol-doge-hype-ada
2026-04-06,Consumer hardware trade in danger as Iran war triggers memory chip pricing explosion,"The AI boom is keeping hardware stocks afloat, but a 70% spike in memory contract prices is creating a ""demand destruction"" trap for everything from laptops ...",Yahoo Entertainment,https://finance.yahoo.com/news/consumer-hardware-trade-in-danger-as-iran-war-triggers-memory-chip-pricing-explosion-144857982.html
2026-04-06,"The address, the favors, the hostage situation, the Mimis doctrine: “Go to court,” the shouts and whispers of the blue parliamentary group, Alpha Trust was sold","How Greeks on Wall Street build trust with investors & Greek robotics shows its strength
The post The address, the favors, the hostage situation, the Mimis doctrine: “Go to court,” the shouts and whispers of the blue parliamentary group, Alpha Trust was sold …",Protothema.gr,https://en.protothema.gr/2026/04/06/the-address-the-favors-the-hostage-situation-the-mimis-doctrine-go-to-court-the-shouts-and-whispers-of-the-blue-parliamentary-group-alpha-trust-was-sold/
2026-04-06,Tom Lee’s BitMine Nears 4% of Ethereum Supply as ETH Price Hits Weekly High,"Publicly traded Ethereum treasury firm BitMine Immersion Technologies added $150 million of ETH last week, boosting its $10.3 billion stash.",Decrypt,https://decrypt.co/363378/tom-lee-bitmine-4-percent-ethereum-supply-eth-price-weekly-high
2026-04-06,Everstone leads $150 million infusion in SaaS firm Wingify,"Software firm Wingify secured Rs 1,381 crore in a new funding round led by Everstone Capital. This investment follows Wingify's recent announcement of a merger with AB Tasty. The combined entity aims to become a major global platform for digital experience op…",The Times of India,https://economictimes.indiatimes.com/tech/startups/everstone-leads-150-million-infusion-in-saas-firm-wingify/articleshow/130063558.cms
2026-04-06,Knicks Bulletin: ‘Nothing in the past really matters’,"Final week of regular-season play for your New York Knickerbockers. Would you believe it!? Looks like yesterday when we projected the team to win 50-plus games this season, and look at the boys now. Do you know what else we projected for the playoffs? Uh, oh,…",Posting and Toasting,https://www.postingandtoasting.com/knicks-news/81102/knicks-bulletin-nothing-in-the-past-really-matters
2026-04-06,Veteran analyst drops a surprise verdict on S&P 500,"The U.S. stock market has been choppy, to say the least, swinging back and forth as President Donald Trump sends mixed signals on the Iran war. However...",TheStreet,https://www.thestreet.com/investing/veteran-analyst-drops-a-surprise-verdict-on-sp-500
2026-04-06,Ticket savings of up to $500 this week for Disrupt 2026 | TechCrunch,"Save nearly $500 on your ticket to TechCrunch Disrupt 2026. This offer disappears Friday, April 10, at 11:59 p.m. PT. Register here before rates hike.",TechCrunch,https://techcrunch.com/2026/04/06/massive-ticket-savings-of-up-to-500-this-week-for-techcrunch-disrupt-2026/
2026-04-06,5 Best Crypto Casinos in 2026 – List of Top Bitcoin Casinos,"Looking for the best crypto casinos in 2026? We review the top 5 bitcoin casinos based on privacy, RTP, game volume, sports, and jackpots. Find your perfec

Read More: https://punchng.com/5-best-crypto-casinos-in-2026-list-of-top-bitcoin-casinos/",The Punch,https://punchng.com/5-best-crypto-casinos-in-2026-list-of-top-bitcoin-casinos/
2026-04-06,"Masters 2026 odds, picks, predictions, favorites: Expert fading Rory McIlroy at Augusta National",SportsLine golf expert David Bearman just locked in his predictions for the 2026 Masters at Augusta National Golf Club,CBS Sports,https://www.cbssports.com/golf/news/masters-2026-favorites-to-win-odds-picks-predictions/
2026-04-06,A first visit to Augusta - Masters' fortunes of Irish 17,"When Tom McKibbin tees off at Augusta National on Thursday, he'll become the 18th Irishman to have done so in golf's most famed tournament. Here's the varying fortunes of the 17 before him on their first drive down Magnolia Lane.",RTE,https://www.rte.ie/sport/golf/2026/0406/1566917-a-first-visit-to-augusta-masters-fortunes-of-irish-17/
2026-04-06,"US Stocks today: S&P 500, Nasdaq open higher as investors weigh Mideast resolution hopes","The ​S&P 500 ​and the Nasdaq ​opened higher on Monday after the indexes marked ‌their ⁠biggest ⁠weekly jump in ​four months in the last ​session, while investors assessed prospects of an ​end to ⁠the Middle ‌East ​conflict.",The Times of India,https://economictimes.indiatimes.com/markets/us-stocks/news/us-stocks-today-sp-500-nasdaq-open-higher-as-investors-weigh-mideast-resolution-hopes/articleshow/130062847.cms
2026-04-06,Bitmine's ether treasury hits 4.8 million ETH as stock listing moves to NYSE,"The company now holds 3.98% of all ether in circulation, has staked $7.1 billion of it, and says it is generating $196 million in annualized staking revenue.",CoinDesk,https://www.coindesk.com/markets/2026/04/06/bitmine-s-ether-treasury-hits-4-8-million-eth-as-stock-listing-moves-to-nyse
2026-04-06,What Makes Wingstop (WINGS) an Investment Choice?,"ClearBridge Investments, an investment management company, released its “ClearBridge Select Strategy” Q4 2025 investor letter. A copy of the letter can be...",Yahoo Entertainment,https://finance.yahoo.com/markets/stocks/articles/makes-wingstop-wings-investment-choice-132259120.html
2026-04-06,Show HN: CalcMonte – Monte Carlo simulation for loans and investments,"Compare loan scenarios side by side. Simulate investments with real market volatility. See the full range of outcomes. Free, no signup, 100% private.",Calcmonte.com,https://calcmonte.com/
2026-04-06,"Netflix Must Reimburse Subscribers in Italy After Years of Unlawful Price Increases, Court Rules","""We take consumer rights very seriously and believe our terms have always ​complied with Italian laws and practice,"" the streamer insists
The post Netflix Must Reimburse Subscribers in Italy After Years of Unlawful Price Increases, Court Rules appeared first …",TheWrap,https://www.thewrap.com/industry-news/public-policy-legal/netflix-price-increases-illegal-italy-reimburse-subscribers/
2026-04-06,"Flamel.ai Launches Unified AI Marketing Platform for Franchise Brands, Introduces Luna AI Agent","Flamel.ai unveils the first unified AI franchise marketing platform — and Luna, the AI agent built exclusively to run",Htrnews.com,https://htrnews.com/press-release/story/83558/flamel-ai-launches-unified-ai-marketing-platform-for-franchise-brands-introduces-luna-ai-agent/
2026-04-06,US Stock Futures Rise as Dip Buyers Return Amid Ceasefire Hopes,US equity futures edged higher and crude oil slipped as investors focused on signs of a potential diplomatic push toward a ceasefire in the Iran war.,Financial Post,https://financialpost.com/pmn/business-pmn/us-stock-futures-rise-as-dip-buyers-return-amid-ceasefire-hopes
